<?xml version="1.0" encoding="UTF-8"?>
<Entity xmlns="http://www.example.org/Entity" 
	xmlns:xsi="http://www.w3.org/2001/XMLSchema-instance" 
	xsi:schemaLocation="http://www.example.org/Entity Entity.xsd "
	tableName="tipoarchivo">

  <field property="codigo"            	sqlName="tar_codigo"         	   	type="String"  key="true" />
  <field property="descripcion"   		sqlName="tar_descripcion"    		type="String"/>
  <field property="observaciones"   	sqlName="tar_observaciones"    		type="String"/>
  <field property="fechaCreacion"   	sqlName="tar_fec_creacion"    		type="Timestamp"/>
  <field property="ultModificacion"   	sqlName="tar_fec_ultmodificacion"   type="Timestamp"/>
  <field property="usuario"   			sqlName="tar_usr_id"    			type="String"/>
  <field property="codigoBaseDatos"   	sqlName="tar_bdt_codigo"    		type="String"/>
  
</Entity>
